,0,1,2,3,4
6,2020-01-22,U.S. Manufacturing’s Not Only Decoupling from China,"January 21, 2020
The Commerce Department’s GDP-by-Industry series is almost always overlooked by followers of the economy, and partly that’s the Commerce Department’s fault. Its updates are invariably a quarter behind, so it’s what analysts call a (seriously) lagging indicator that says relatively little about the more important question of what’s in store.
Nonetheless, even when they’re lagging, distinctive and detailed indicators can clarify long-term trends considerably, and that’s why I like GDP-by-Industry and track it so closely. Because it sheds lots of light on some of the most important economic and trade-related issues of the day – and especially on the impact of President Trump’s tariff-heavy policies. Specifically, the latest set of figures, which were issued January 9, reveal that during the Trump administration, the United States has continued to progress toward the worthy goal of reducing domestic manufacturing’s dependence on imports (and especially imports from increasingly hostile countries like China) for acceptable levels of growth.
In other words, the People’s Republic isn’t the only country from which American manufacturing is decoupling.
According to the new data, the latest year-on-quarter results show that between the third quarter of 2018 and the third quarter of 2019, U.S. manufacturing output (measured according to a gauge called gross value added) increased by 1.21 percent. That’s not much. But the manufacturing trade deficit during this period rose by only 2.55 percent. (Both figures are in pre-inflation dollars, because inflation-adjusted manufacturing trade figures aren’t available.)
Although this growth rate is lower than that achieved between the second quarter of 2018 and the second quarter of 2019 (2.03 percent), that figure was accompanied by a much faster increase in the manufacturing trade deficit (7.83 percent). The first quarter to first quarter results? Manufacturing production growth of 2.76 percent, and manufacturing trade deficit increase of 1.29 percent. That is, manufacturing output actually grew faster than the trade deficit. So from that standpoint, the third quarter result are disappointing.
They look even more disappointing when compared with the results from the first two years of the Trump administration. In 2017, manufacturing production also grew somewhat faster (3.99 percent) than the increase in manufacturing’s trade gap (3.16 percent), and in 2018, output grew much faster (6.23 percent to 3.96 percent).
These Trump presidency figures, in turn, have been much better than those reported for President Obama’s administration. Once the current economic recovery entered a normal phase (2011), the manufacturing trade deficit grew much faster than output ever year except for 2013.
So what’s the case for the latest third quarter 2018-third quarter 2019 figures representing continued progress? And why should anyone be happy with 1.21 percent annual manufacturing output growth no matter what’s happening on the trade deficit side?
Two answers suggest themselves. First, since the President began imposing tariffs in earnest (essentially, in April, 2018), importers have been “front-running” their purchases from abroad. Their efforts to secure these deals before various sets of tariffs kicked in has produced several short-term distortions in the trade deficit in particular. Second, since the spring, Boeing’s safety woes have exerted a major drag both on domestic manufacturing output and on industry’s trade performance – since the aircraft giant has long been America’s leading exporting company.
Just one example of the difference Boeing has made: Between the third quarters of 2018 and 2019, the U.S. civilian aircraft trade surplus dropped from just under $10 billion to just under $6.5 billion. Civilian aircraft is of course the product category containing Boeing’s troubled 737 Max jet, and the plane was grounded worldwide, or banned from many national airspaces, starting in March.
The relationship between trade balances and production is never one-to-one, especially over relatively short time frames. And the matter becomes more complicated in sectors like aircraft, with its long lead times and generally large backlogs. But it’s difficult to believe that the 737 Max crisis and the narrowing of the aircraft trade surplus hasn’t impacted American civilian aircraft production and exports at all. (In fact, between those two quarters civilian aircraft exports, which are strongly related to output levels, sank by $2.75 billion, or nearly 22 percent.)
Moreover, for the purposes of comparing manufacturing output growth and the manufacturing’s trade deficit growth, the aircraft troubles are significant. Had the category’s trade performance simply remained the same between the third quarters of 2018 and 2019, the trade shortfall would have increased not by 2.55 percent, but 1.25 percent – less than half the rate. As result, during that period, manufacturing’s output (1.21 percent) and trade deficit would have grown at very nearly the same pace.
What does the future hold for this key ratio? On the one hand, civilian aircraft production is bound to decrease for the foreseeable future due to the 737 Max production halt announced by Boeing in mid-December. On the other, numerous signs indicate that industry overall has come out of the recession that dogged it for much of the last year and a half (and that by some output measures, never happened at all). Moreover, the Phase One trade deal signed by the United States and China last week could well reduce at least some of the tariff-related uncertainty that’s clearly slowed manufacturing-heavy capital spending decisions by American business in general, and certainly in manufacturing itself.
That looks like a modest case for domestic manufacturing continuing its longer term trend of becoming more self-sufficient while growing adequately – a development that makes major sense in a world that’s far more uncertain.
ALAN TONELSON
Alan Tonelson, a columnist for IndustryToday, is founder of the RealityChek blog (alantonelson.wordpress.com), which covers manufacturing, trade, the economy, and national security. He has written for many leading publications on these subjects and is the author of The Race to the Bottom (Westview Press, 2000).",https://industrytoday.com/u-s-manufacturings-not-only-decoupling-from-china/,empty
7,2020-01-22,Importance of Transitional Planning,"National Center for the Middle Market (NCMM)
COLUMBUS, OH — New research from the National Center for the Middle Market (NCMM) finds that more than three-quarters of middle market businesses have either experienced a major transition in the past five years or expect one in the next five years. Far from being unusual, major transitions are business as usual: More than half (54 percent) experienced and expect to experience major transitions, often more than once in a given five-year period. Transitions studied included acquisitions, CEO succession, being acquired or taking on transformational new investment, and restructuring.
Preparing for Major Business Transition, a special report by the NCMM shows that the more companies prepare for transitions, the better results they get. While the vast majority — more than 90 percent — of well-prepared companies say their transitions were successful, only a third of less-well-prepared companies say the same. The study also reveals the importance of assembling a team of trusted advisors to help executives chart a path through transition.
“With baby boomers nearing retirement, an influx of private-equity funding, low interest rates and high valuations, we’re seeing a perfect storm of factors lining up for increased transitions in the near future,” said NCMM Executive Director Thomas A. Stewart. “If these companies prepare for their coming transitions, their results can lead to strong positive outcomes.”
The report, based on results of a survey conducted by NCMM in collaboration with SunTrust Banks (now Truist) and Chubb, polled 404 middle market leaders with active responsibility for strategic decision making. The survey was fielded in November 2019.
“Middle market companies have much to gain from a comprehensive approach to transition planning,” said NCMM Managing Director Doug Farren. “By learning from our key insights, including the importance of trusted advisors and the keys to succession planning, executives can set their companies up for success now and into the future.”
About the National Center for the Middle Market (NCMM)
The National Center for the Middle Market is a collaboration between The Ohio State University Fisher College of Business and Chubb. It exists for a single purpose: to ensure that the vitality and robustness of Middle Market companies are fully realized as fundamental to our nation’s economic outlook and prosperity. The Center is the leading source of knowledge, leadership, and innovative research on the middle market economy, providing critical data analysis, insights, and perspectives for companies, policymakers and other key stakeholders to help accelerate growth, increase competitiveness and create jobs in this sector.
Housed at The Ohio State University Fisher College of Business, the National Center for the Middle Market is the first center of its kind in the nation. The Center enthusiastically serves middle market firms, students, academic researchers, policy makers, the media and other key stakeholders with interests in the health and well-being of the middle market. The Center is fully committed to funding and distributing the most credible open-sourced research, dynamically creating new knowledge, providing programs that drive value for middle market companies, and offering a well-informed outlook on the health and future of the middle market via the Middle Market Indicator.
About Truist
Truist Financial Corporation (NYSE: TFC) is a purpose-driven company dedicated to building a better future for its clients, teammates and communities. With 275 years of combined BB&T and SunTrust history, Truist is one of the nation’s largest financial services holding companies offering a wide range of services including retail, small business and commercial banking; asset management; capital markets; commercial real estate; corporate and institutional banking; insurance; mortgage; payments; specialized lending and wealth management. Headquartered in Charlotte, North Carolina, Truist serves approximately 10 million households with leading market share in many high-growth markets in the country.",https://industrytoday.com/importance-of-transitional-planning/,empty
8,2020-01-22,Lighthouses Revitalize U.S. Manufacturing,"World Economic Forum’s Global Lighthouse Network helps manufacturing industry catch up to rest of the world in adoption of Fourth Industrial Revolution technology.
January 18, 2020
By Isabel Yang, Chief Technology Officer and Senior Vice President, Advanced Energy
The Internet of Things (IoT) has brought significant advancements to nearly every sector of society, dramatically changing the way we live, how we work and what we produce. Particularly as consumers benefit from IoT technologies enabling the evolution of semi-autonomous vehicles, smart homes, voice assistants and fitness trackers. We cannot overlook the fact that IoT is also driving the Fourth Industrial Revolution (Industry 4.0).
At the World Economic Forum’s annual meeting in Davos, Switzerland, in 2018, top advisors from the private and public sector set out to identify manufacturing’s transformation leaders who are frontrunners charting a new course and paving the way. What followed was a 2019 white paper in which 16 geographically diverse companies are starting to reap the rewards of IIoT as early adopters. In todays fast changing world of digital disruption, early adopters not only gains markets advantage, but in some cases becomes winner takes all. These 16 companies, presented as “Lighthouses,” exhibited all of the essential characteristics of Industry 4.0 but also reflected the globalization of industrial manufacturing and the opportunities available for factories of all sizes anywhere on the planet.
Innovation in manufacturing is critically important considering its prominence in the world’s economies. According to research from Brookings, China leads with over $2.01 trillion in output, which accounts for 27 percent of China’s overall national output and 20 percent of the world’s manufacturing output. The United States is second at $1.867 trillion, representing 12 percent of the nation’s output and 18 percent of the world’s capacity. In terms of employment, Poland leads with 20.2 percent of its workers engaged in manufacturing, followed by Germany (19 percent), Italy (18.5 percent), Turkey (18.1 percent), South Korea (16.9 percent), China (16.9 percent) and Japan (16.9 percent). With statistics like those, it’s fair to say stakes are high. Here in America, where approximately 10.5 percent of the workforce is employed in manufacturing, a report from McKinsey suggests that, by upgrading plants and equipment with Industrial IoT (IIoT) technologies, the U.S. has the potential of raising manufacturing GDP by more than $500 billion annually.
The Industrial IoT (IIoT) connecting a network of machines and sensors that communicate with each other and humans will undoubtedly transform every aspect of production, from the plant floor to the end user experience. Witnessed by the success of the lighthouse factories, these new digital technologies and automated processes are tangibly demonstrating their ability to drive productivity and reduce human error. More automation, however, requires more power. And, at the core, it is the consistent, specific and reliable energy supplies that provide the lifeblood of the smart factory. Even brief aberrations or voltage sags can create a domino effect of detrimental consequences. Voltage sags, or dips, are the most common events affecting power quality—and costly. Smart factories with robots and PLCs (Programmable Logic Controllers) for controlling motors, pumps, lights, fans, circuit breakers and other machinery, are more vulnerable to voltage sags as equipment complexity increases.
Monitoring and controlling temperature is also one of the highest costs for manufacturers. Inaccurate low and high operating temperatures can result in product failure, premature machine failure, unexpected shutdowns and in rare circumstances equipment meltdowns and fires. Thermal control is critical the production of steel, glass, plastics, coatings and plasma, which is ubiquitous in the electronics industry with flat panel displays such as televisions and computers. As display sizes and resolution increase, the negative financial impact of film defects is magnified, putting extreme demands on equipment suppliers. Additionally, rapid change and process interruptions require manufacturing equipment to be increasingly flexible and reliable. Minimizing arc energy while maintaining a stable, repeatable process helps in achieving higher film quality, increasing yields and reducing manufacturing costs. This requires tight performance parameters, customizable power delivery, precision pulsing and multi-level arc management to enable process stability and control. Such solutions offer the kind of consistent energy flow necessary for today’s most advanced machines and sensors powering smart factories.
In our industry, which includes manufacturing semiconductor and industrial glass coatings among other things, innovation has been a top priority at home in the U.S. and abroad, where Advanced Energy (AE) continues to bring highly engineered, precision power conversion, measurement and control solutions to help customers worldwide with their mission-critical applications and processes. Our new facility in Caesarea, Israel underscores that commitment. The new 6,500 square-foot facility includes business offices and a state-of-the-art R&D lab that advances AE’s goal to provide customers in the semiconductor, medical, defense and industrial markets with the most reliable, smart technologies and resources. The inclusion of an on-site services and repair facility will also help to support AE’s regional customers, who increasingly require access to high-quality local service for their power systems and controls.
Industry 4.0 is essential to breaking out of productivity stagnation—and designing a resilient smart IoT-enabled power supply is an essential part of manufacturing’s digital transformation. With higher power consumption inevitable, factories must be proactive in addressing power management, as well as energy efficiency goals, thermal impact and the need for improved reliability and safety. This is no easy task, but with lighthouses paving the way, the U.S. manufacturing industry can initiate a profound shift that impacts every aspect of modern society.
About ISABEL YANG
Dr. Isabel Yang is chief technology officer and senior vice president of Advanced Energy, responsible for leading the execution of the company’s global technology vision and strategy. Dr. Yang holds multiple patents, has written extensively for more than 40 technical publications and was the recent recipient of Most Influential Women in Manufacturing Award as well as well Denver Business Journal C-Suite Award. Dr. Yang completed all of her higher education at MIT, receiving a bachelor’s degree in material science, a master’s degree and Ph.D. in electrical engineering, specializing in solid state physics and semiconductors.
About Advanced Energy
Advanced Energy (Nasdaq: AEIS) is a global leader in the design and manufacturing of highly engineered, precision power conversion, measurement and control solutions for mission-critical applications and processes. AE’s power solutions enable customer innovation in complex semiconductor and industrial manufacturing applications. With engineering know-how and responsive service and support around the globe, the company builds collaborative partnerships to meet technology advances, propel growth for its customers and innovate the future of power. Advanced Energy has devoted more than three decades to perfecting power for its global customers and is headquartered in Fort Collins, Colorado, USA. For more information, visit www.advancedenergy.com.
Advanced Energy | Precision. Power. Performance.",https://industrytoday.com/lighthouses-revitalize-u-s-manufacturing/,empty
9,2020-01-22,Nestlé to offer Starbucks experience in the home with new product line-up,"American coffeehouse chain, Starbucks, and Swiss food and drink company, Nestlé, have strengthened their ongoing collaboration further with today’s launch of new coffee products under the Starbucks brand.
The new range includes: Fresh Brew coffee, Cold Brew concentrate; and Starbucks coffee blends containing golden turmeric and essential vitamins among others. This range allows consumers to satiate their cravings for Starbucks coffee even at home.
The new line-up will be available in US grocery stores nationwide from February 2020.
The new offerings come as part of a $7.1 billion global alliance signed by Nestlé and Starbucks’ 2018. Through the deal, Nestlé has acquired a global license to produce Starbucks-branded products, including ground and roast coffee, as well as portioned and soluble coffee, teas and creamers. However, the arrangement excludes sales of any products – produced as part of the agreement – at any Starbucks outlet. Nestle also took on around 500 Starbucks employees as part of the deal.
The deal kick-started with the duo’s launch of a new line-up in February 2019. The range included 24 products, such as single-origin coffees, signature Starbucks blends and classic preparations like Cappuccino and caramel macchiato, all made using 100% ethically sourced Arabica beans.
The range also marked the debut of Starbucks capsules, which have been developed using Nestlé’s proprietary Nescafé Dolce Gusto and Nespresso technologies.
The partnership is strategically important for both companies which have come together to create a stronger collaboration in the highly fragmented consumer beverages market. The market is seeing a slew of new entrants and an increasing number of mergers, acquisitions and alliances aimed at taking over a bigger share of the global coffee market that is expected to be worth $102.28 billion by 2023.
Transactions such as Coca Cola’s acquisition of Costa and JAB Holdings’ expansion of its coffee portfolio, which included the acquisition of Peet’s Coffee & Tea, Keurig Green Mountain, Caribou Coffee, Jacobs Douwe Egberts and several others, emphasise the growing focus of investors in the coffee segment and the rapid consolidation of the segment.
The coffee market is predicted to undergo significant growth, bolstered by changing urban lifestyle habits, increasing demand for on-the-go food and beverages and increasing customer purchasing power.
Nestle’s Chief Executive Mark Schneider has already identified coffee as a strategic category for investment and the company’s latest developments, including its acquisition of a majority stake in Blue Bottle Coffee, purchase of Texas-based Chameleon Cold-Brew and even the Starbucks deal, all indicate that the Swiss company is well on track to emerge as the top player in the coffee market.",https://www.themanufacturer.com/articles/nestle-offer-starbucks-experience-home-new-product-line/,empty
