,0,1,2,3,4
10,2020-01-22,New-found method could simplify aerospace-grade composite manufacturing,"A new method using carbon nanotubes to create aerospace-grade composites without an autoclave has been developed by researchers at the Massachusetts Institute of Technology (MIT).
The new process, which could revolutionise aerospace manufacturing, doesn’t require pressure vessels and huge ovens, which are currently used in the manufacture of airplane primary structures.
The research team included: Brian Wardle, professor of aeronautics and astronautics at MIT; Jeonyoo Lee, a postdoctoral student at the MIT; and Seth Kessler, President and CEO of Metis Design Corporation, a Boston, Massachusetts-based aerospace structural health monitoring company.
Using existing techniques the production of an aeroplane’s main body involves multiple sheets of several composite materials, which are arranged and moulded into the shape of a fuselage and put into gigantic ovens and autoclaves in which those layers are fused together to form a strong and tough aerodynamic shell.
Wardle says, “If you’re making a primary structure like a fuselage or wing, you need to build a pressure vessel, or autoclave sometimes the size of a three-story building, which itself requires time and money to pressurise. These things are massive pieces of infrastructure. We are working towards making primary structure materials without autoclave pressure, so we can get rid of all that infrastructure.”
In 2015, Lee led the team, along with another member of Wardle’s lab, in creating a method to make aerospace-grade composites without requiring an oven to fuse the materials together. Instead of placing layers of material inside an oven to cure, the researchers essentially wrapped the materials in an ultrathin film of carbon nanotubes (CNTs).
When they applied an electric current to the film, the CNTs (picture a nanoscale electric blanket), quickly generated heat, causing the materials within to cure and fuse together.
That method, known as “out-of-oven” (or OoO), produced composites that were as strong as the materials made in conventional aeroplane manufacturing ovens, by using just 1% of the energy.
Removing the need for an autoclave altogether
The team’s next step was to look for ways to manufacture high-performance composites without the use of large, high-pressure autoclaves that create high amount of pressure to press materials together, squeezing out any voids, or air pockets.
Previous research by Spirit AeroSystems working in collaboration with the University of Strathclyde helped develop a manufacturing process that didn’t use an autoclave but instead a multi-zone heated tool with advanced control to tailor the curing cycle time to match individual part geometries.
Other researchers including Wardle’s group have also explored “out-of-autoclave,” or OoA, techniques to manufacture composites without using the huge machines. But most of these techniques produced composites where nearly 1% of the produced materials contained voids, which can compromise a material’s strength and lifetime. In comparison, aerospace-grade composites made in autoclaves are of such high quality that any voids they contain are neglible and not easily measured.
“The problem with these OoA approaches is also that the materials have been specially formulated, and none are qualified for primary structures such as wings and fuselages,” Wardle says. “They’re making some inroads in secondary structures, such as flaps and doors, but they still get voids.”
A new solution to out-of-autoclave
Part of Wardle’s latest work focuses on developing nanoporous networks — ultrathin films made from aligned, microscopic material such as carbon nanotubes, that can be engineered with exceptional properties, including color, strength, and electrical capacity.
The researchers investigated whether the nanoporous films could be used in place of giant autoclaves to squeeze out voids between two material layers, as unlikely as that may seem.
The researchers proposed that if a thin film of carbon nanotubes were sandwiched between two materials, then, as the materials were heated and softened, the capillaries between the carbon nanotubes should have a surface energy and geometry such that they would draw the materials in toward each other, rather than leaving a void between them. Lee calculated that the capillary pressure should be larger than the pressure applied by the autoclaves.
The researchers tested this concept by growing films of vertically aligned carbon nanotubes, then laying the films between layers of materials that are typically used in the autoclave-based manufacturing of primary aircraft structures. The researchers wrapped the layers in a second film of carbon nanotubes, which they applied an electric current to, in order to to heat it up. They observed that as the materials heated and softened in response, they were pulled into the capillaries of the intermediate CNT film.
The resulting composite lacked voids, similar to aerospace-grade composites that are produced in an autoclave. The researchers subjected the composites to strength tests, attempting to push the layers apart, the idea being that voids, if present, would allow the layers to separate more easily.
“In these tests, we found that our out-of-autoclave composite was just as strong as the gold-standard autoclave process composite used for primary aerospace structures,” Wardle says.
The team will next look for ways to scale up the pressure-generating CNT film. In their experiments, they worked with samples measuring several centimeters wide — large enough to demonstrate that nanoporous networks can pressurize materials and prevent voids from forming. To make this process viable for manufacturing entire wings and fuselages, researchers will have to find ways to manufacture CNT and other nanoporous films at a much larger scale.
“There are ways to make really large blankets of this stuff, and there’s continuous production of sheets, yarns, and rolls of material that can be incorporated in the process,” Wardle says.
He plans also to explore different formulations of nanoporous films, engineering capillaries of varying surface energies and geometries, to be able to pressurize and bond other high-performance materials.
“Now we have this new material solution that can provide on-demand pressure where you need it,” Wardle says. “Beyond airplanes, most of the composite production in the world is composite pipes, for water, gas, oil, all the things that go in and out of our lives. This could make making all those things, without the oven and autoclave infrastructure.”
This research was supported, in part, by Airbus, ANSYS, Embraer, Lockheed Martin, Saab AB, Saertex, and Teijin Carbon America through MIT’s Nano-Engineered Composite aerospace Structures (NECST) Consortium.",https://www.themanufacturer.com/articles/new-found-method-simplify-aerospace-grade-composite-manufacturing/,empty
11,2020-01-22,Honda and Isuzu to test fuel cell-powered heavy-duty trucks,"Honda and Isuzu have collaborated to conduct a joint research project where they will use hydrogen fuel cells to power heavy-duty trucks.
The Japanese automotive manufacturers, which are aiming to expand the use of fuel cells to apply zero-emission technology to larger vehicles, will be sharing their technological expertise under a two-year official contract.
Under the agreement, Honda’s expertise in developing fuel cell systems will be combined with Isuzu’s specialty in building heavy-duty trucks. The latter’s intention to test Honda’s fuel cell drive train in its commercial vehicles would expand the scope for the entire automotive industry, as the technology could be used in a wide range of vehicles in the future.
This is the first time that Honda has given an ‘outsider’ access to its fuel cell technology.
Importance of hydrogen for commercial vehicles
Speaking with reporters, a Honda spokesperson said: “Although we have done extensive R&D into passenger FCVs (fuel cell vehicles), we have not been able to study how best to apply the technology to commercial vehicles. This partnership will allow us to do that.”
Isuzu has been endorsing the use of low-carbon and sustainable energy for quite some time. To achieve that goal, the company has been researching and developing different powertrains, such as clean diesel engines, engines for natural gas vehicles (NGVs) and electric vehicles (EV) powertrains. Similarly, Honda has been putting efforts to promote carbon-free society and thus has been involved in researching and developing FCVs for over three decades.
Vehicles running on hydrogen fuel cells have been lauded as an ultimate eco-friendly transport owing to their absolute zero greenhouse emissions and typically providing greater mileage and faster refuelling than EVs. However, the lack of proper refuelling infrastructure has greatly restrained the adoption of these vehicles.
As global emissions regulations have continued to tighten every year, automobile companies are developing a greater number of EVs. Most industry experts perceive EVs as the answer for passenger cars in city areas, but hydrogen fuel cells are often touted as an efficient solution for longer journeys and to power large vehicles like buses and trucks.
The global market for hydrogen autos totalled only about 4,000 vehicles in 2018, compared with 1.4 million EVs sold in the same year.",https://www.themanufacturer.com/articles/honda-isuzu-test-fuel-cell-powered-heavy-duty-trucks/,empty
12,2020-01-21,Schneider Electric arc flash mitigation technology now available across Canada,"Schneider Electric has announced that its Square D brand’s patented arc flash mitigation technology, ArcBlok, is now available across Canada, for Model 6 Motor Control Centers.
ArcBlok offers a simple safety measure to protect electrical workers and equipment.
It uses digital thermal sensors and Zigbee communications protocols for enhanced control and system visibility. This offers additional control to monitor ArcBlok-enabled Motor Control Centers remotely through solutions such as Schneider Electric’s EcoStruxure system.
Temperatures can be measured with mobile devices using Near Field Communication tags, reducing reliance on personal protection equipment and administrative controls.
Schneider Electric’s Model 6 Motor Control Center with ArcBlok technology is tested to IEEE/ANSI C37.20.7 requirements.
Once installed, the system mitigates the chance for an arc flash event, and if an event occurs, the resulting arc energy is contained in reinforced structures, rated for fault current at 100 kA at 480V and 50kA at 600V.",https://www.automationmag.com/schneider-electric-arc-flash-mitigation-technology-now-available-across-canada/,empty
13,2020-01-21,Plugin vulnerability finders tell WordPress users to update asap,"Three WordPress plugins have been picking up quite the glare of attention this month after researchers found serious vulnerabilities in them—and the numbers are sobering, in that these plugins have been installed on more than 400,000 websites—with users too wide open for cyberattacks to ignore.
The three plugins in the spotlight were InfiniteWP, WP Time Capsule, and WP Database Reset plugins.
ZDNet was one of the tech watching sites to prod readers to action: ""If you use these plugins you should update immediately as firewall l protection will not work.""
HotHardware's Brittany Goetting offered some more grim numbers. There are over 50,000 plugins to go round and not all are created equal, she wrote.
Out of the three in the spotlight, one may as well begin with the authentication bypass vulnerability in the InfiniteWP Client. Naked Security described it as a tool that allows admins to manage multiple WordPress sites from the same interface.
Administrators overseeing sites use InfiniteWP Client.
At least 300,000 of sites could have been affected by the vulnerability, Goetting said.
The plugin, it was found, lacked certain authorization checks. ""You are vulnerable if you are using InfiniteWP Client versions up to 1.9.4.4, and as a result users of the plugin should update their sites to version 1.9.4.5 as soon as possible,"" she wrote.
The Wordfence blog (Wordfence is product of a company called Defiant) said this was a critical authentication vulnerability. ""A proof of concept was published this morning, January 14, 2020. If you are using InfiniteWP client version 1.9.4.4 or earlier we recommend immediately updating your installation to protect your site.""
Dan Goodin in Ars Technica also described the seriousness of the authentication bypass vulnerability in InfiniteWP Client plugin.
""It allows administrators to manage multiple websites from a single server. The flaw lets anyone log in to an administrative account with no credentials at all. From there, attackers can delete contents, add new accounts, and carry out a wide range of other malicious tasks.""
Security company WebARX reported InfiniteWP Client, and another vulnerability, WP Time Capsule.
The WP Time Capsule was designed to make backing up website data easier.
Ars Technica reported that the bug had been fixed in version 1.21.16. ""Sites running earlier versions should update right away. Web security firm WebARX has more details."" said Ars.
ZDNet talked about WP Time Capsule; Charlie Osborne in ZDNet said that WP Time Capsule was active on at least 20,000 domains, according to the WordPress plugins library.
The WP Database Reset plugin received much attention, with nearly 80,000 sites using the plugin, which helps users to reset their databases or parts of databases to their default settings.
Wordfence: ""On January 7th, our threat Intelligence team discovered vulnerabilities in WP Database Reset, a WordPress plugin installed on over 80,000 websites. One of these flaws allowed any unauthenticated user to reset any table from the database to the initial WordPress set-up state, while the other flaw allowed any authenticated user, even those with minimal permissions, the ability to grant their account administrative privileges while dropping all other users from the table with a simple request.""
The plugin did not initially include the proper security checks. ""One vulnerability allowed attackers to reset any table and cause a loss of data availability,"" wrote Goetting. ""Another vulnerability enabled any subscriber to take full control of the website and kick out all administrators. Both flaws have thankfully been fixed with version 3.15. Of course the security researchers also encourage users to always back up their sites.""
Sergiu Gartlan for BleepingComputer paid attention to that finding too. ""Critical bugs found in the WordPress Database Reset plugin ...allow attackers to drop all users and get automatically elevated to an administrator role and to reset any table in the database.""
The Wordfence blog issued this advice, seeing that these were considered critical security issues that could cause complete site reset and/or takeover. ""We highly recommend updating to the latest version (3.15) immediately.""
What did Ars Technica conclude about the three plugins, InfiniteWP, WP Time Capsule, and WP Database Reset? They had few words and these came easily: ""It's time to patch.""
Readers' comments in Ars were attempting to pinpoint the source of the problems. ""The problem,"" said one reader, ""is when site admins install 10,000 plugins, each of which becomes a new vector for attack.""
Where did users hear that before? Computer Business Review, back in June, declared that ""WordPress Plugins are widely regarded to be one of the single greatest security threats to WordPress users.""
There's no evidence that any of the three vulnerable plugins are being actively exploited in the wild, said Goodin.
More information: blog.sucuri.net/2020/01/authen … finitewp-client.html
© 2020 Science X Network",https://techxplore.com/news/2020-01-plugin-vulnerability-finders-wordpress-users.html,empty
14,2020-01-21,Manufacturer Faces Phishing Attack,"CEO fraud is creating massive headaches. The scary part is you don’t even need to be hacked for this fraud to be carried out.
Credential Phishing Leads to Inbox Infiltration
The scam all began when the CEO fell for a credential phishing email. Credential phishing emails are used by malicious actors to try and trick individuals into voluntarily handing over their login details, typically by directing them to a link that takes them through to a fake login page. In this case, the CEO received an email from what he thought was Microsoft. The email stated that his account details needed to be validated in order for him to continue to use the Outlook service without disruption. As the email appeared to have come from an official source, the CEO clicked on the link. The link took him through to a seemingly legitimate landing page, where he inputted his email login details. Assuming that his account had been validated, the CEO gave no further thought to the incident.
However, by inputting his credentials on this login page, he had actually passed on his details to a fraudster who could now access his account. Gaining access to the CEO’s email account allowed the fraudster to gather valuable information about how invoice payments were processed at this company. For example, it allowed the fraudster to take a look at previous invoices that had been sent from the insured’s contract manufacturers and suppliers and to identify the main individual in the insured’s finance department responsible for paying invoices and authorizing wire transfer requests. What’s more, it also allowed the fraudster to gain access to the CEO’s Outlook calendar and establish what the CEO would be doing on any given work day.
Having worked out the CEO’s schedule from his calendar, the fraudster waited until the CEO was travelling abroad for a few weeks on a business trip. With the CEO out of the office and with the chances of the scam being uncovered much reduced, the fraudster chose this moment to strike.
The fraudster’s plan involved posing as a member of the accounts department for one of the insured’s contract manufacturers.
The fraudster’s first step was to set up forwarding rules in the CEO’s email account. Forwarding rules are settings that can be applied to an email account which ensure that emails that fall within a certain criteria are automatically forwarded to a specific folder or to another email account. In this case, the fraudster set up two rules to ensure that the CEO didn’t come across any of the emails related to the scam while he was away on business. The first rule that was created meant that any emails from the individual responsible for approving payments were immediately marked as read and sent directly into the account’s deleted items folder.
The second rule meant that any email that included a keyword, such as “invoice” or words used in this particular contract manufacturer’s trading name, in the subject line was marked as read and automatically sent to the deleted items folder.
Phony Invoices Lead to Unrecoverable Funds
With the background work now done, the fraudster sent an email to the CEO purporting to be from the accounts department of the contract manufacturer, attaching an invoice for $47,500 and explaining that there had been a change of account details. To add an air of authenticity to the scam, the fraudster used one of the actual contract manufacturer’s invoices as a template. So to all intents and purposes the invoice looked normal; it featured the contract manufacturer’s logo and address on the heading of the invoice and carried a breakdown of the work carried out. The only difference was that the account details had been altered by the fraudster.
As a result of the forwarding rules in place, this email was immediately marked as read and sent to the deleted items folder. The fraudster then logged into the CEO’s account and, posing as the CEO, forwarded this email to the individual within the finance department responsible for authorizing payments and requested that the payment be made that day.
As the CEO was out of the office and because the email requesting that the invoice be paid had come from his account, the employee in the finance department assumed that this was a legitimate request and paid the invoice.
Having seen that this ruse had worked, the fraudster decided to try their luck and sent through another invoice a few days later. On this occasion, due to the fact that it had only been a few days since the last invoice had been paid, the employee in the finance department responded to the CEO about the request to check that this was correct. Because of the forwarding rules put in place, however, the CEO was oblivious to the employee’s response – only the fraudster was aware of it. In the guise of the CEO, the fraudster responded and explained that all was in order and that the invoice should be paid.
With the employee in the finance department genuinely believing that they were in correspondence with the CEO and with any objections and queries about the payments being swiftly answered, the fraudster managed to get two further invoices approved, bringing the total amount paid out to $190,000.
It was only upon the CEO’s return to the office that the payments came up in discussion and the scam was uncovered. Our policyholder reported the incident to local law enforcement and attempted to recover the funds from the recipient bank, but all of the money had been moved out of the fraudulent account and the prospects of a successful recovery were deemed to be remote.
Thankfully the firm had purchased comprehensive cybercrime cover as part of their cyber insurance policy and were able to recover the loss in full.
Our Best Defence Against The Rise In CEO Fraud
This claim highlights a few key points. Firstly, it illustrates how CEOs and senior executives are prime targets for cybercriminals. CEOs and senior executives usually act as the face of their respective companies and as a result they tend to have bigger profiles on company websites and social media accounts, allowing cybercriminals to gather valuable information about them. In addition, cybercriminals know that employees are instinctively less likely to question and more likely to act upon instructions from senior executives. CEOs and senior executives therefore need to be especially conscious of sticking to good cybersecurity practices, and employees need to be particularly alert to suspicious emails from senior executives and have robust call-back and authentication procedures in place.
Secondly, it shows that cybercriminals are becoming much more sophisticated. In the past, it was not uncommon to see blatant attempts at funds transfer fraud over email, with an urgent appeal for help or bogus prize giveaways being just two examples. Now, however, we are seeing far more nuanced attacks. In this case, the fraudster managed to trick the CEO into volunteering his email login details, identify who was responsible for authorizing payments, and work out when the CEO was out of the office on a business trip. They also set up forwarding rules in the CEO’s inbox to avoid detection and made use of one of the company’s genuine contract manufacturer’s invoice templates to add authenticity to the scam.
Finally, this claim also busts a common myth – that by investing heavily in IT security, there’s no need for cyber insurance.
The fact is that the vast majority of cyber incidents are a result of human error. With increasingly sophisticated attacks like this on the rise, it makes it very difficult for employees to tell the difference between a real email and a fake email or a real invoice and a fake invoice. Furthermore, with more and more financial transactions being carried out electronically, the number of opportunities for cybercriminals to steal these funds has never been greater. Having good training and authentication procedures in place can certainly help reduce the risk of an event like this happening, but it’s impossible for any business to be completely impervious to these kinds of attacks. Cyber insurance serves as a valuable safety net should the worst happen.
James Burns – Cyber Product Leader, CFC Underwriting
James has over a decade’s experience in the London Market, most of which has been spent focused on cyber, building up expertise and insight in this dynamic area. As Cyber Product Leader, James is responsible for ensuring that CFC’s global suite of cyber products remain at the cutting edge of a class where threats continue to rapidly evolve. James travels extensively throughout the UK and North America to give presentations and speak at various events, from educational seminars to panel discussions and industry trade shows.",https://industrytoday.com/manufacturer-faces-phishing-attack/,empty
